{
    "id": "123",
    "leaveTypeId": "1",
    "leaveTypeDescription": "abcd",
    "leaveType": {
        "leaveTypeId": "LWOP LVE",
        "leaveTypeName": "Leave Without Pay",
        "leaveTypeCategoryId": "LWP",
        "leaveTypeCategoryName": "Leave Without Pay",
        "displayReason": false,
        "requireReason": false,
        "displayPartialDays": true,
        "partialDaysOption": "None",
        "displayPayInAdvance": false,
        "displayMedicalCertificate": true,
        "leaveReasons": [
            {
                "leaveReasonId": "A",
                "leaveReasonName": "A"
            },
            {
                "leaveReasonId": "B",
                "leaveReasonName": "B"
            }
        ]
    },
    "startDate": "2015-09-01",
    "endDate": "2015-09-15",
    "leaveReason": "ANL",
    "partialDays": "None",
    "startDayHours": 5,
    "startDayHalfDay": false,
    "endDayHours": 4,
    "endDayHalfDay": false,
    "allDayHours": 6,
    "allDayHalfDay": false,
    "payInAdvance": true,
    "medicalCertificateProvided": false,
    "requesterComments": "",
    "attachment": "",
    "status": ""
}