[
    {
        "id": "123",        
        "leaveTypeId": "leaveType01",
        "leaveTypeDescription": "Leave Type 01",
        "startDate": "2015-09-01",
        "endDate": "2015-09-15",
        "leaveReason": "ANL",
        "partialDays": "None",
        "startDayHours": 5,
        "startDayHalfDay": false,
        "endDayHours": 4,
        "endDayHalfDay": false,
        "allDayHours": 6,
        "allDayHalfDay": false,
        "payInAdvance": true,
        "medicalCertificateProvided": false,
        "requesterComments": "",
        "attachment": "",
        "status": ""
    }
]